william winslow " ( ron perlman ) , the chief psychiatrist at brookdale .	objective
by the end , only one thing is certain - justice is simply a toss of the coin .	objective
the film is almost eerily calm and refuses to take sides . but that lets its insights penetrate all the deeper .	subjective
i've had more interesting -- and , dare i say , thematically complex -- bowel movements than this long-on-the-shelf , point-and-shoot exercise in gimmicky crime drama .	subjective
i know that i'll never listen to marvin gaye or the supremes the same way again	subjective
it all starts to smack of a hallmark hall of fame , with a few four letter words thrown in that are generally not heard on television .	subjective
a strong first quarter , slightly less so second quarter , and average second half .	subjective
the results are as giddy , painful , sad and loving as real life tends to be .	objective
" mudbloods " ( people of muggle families ) are " petrified " by an evil monster lurking in the grounds .	objective
edi is wrongly accused of having raped the girl whose brothers have got the control over one of the city areas .	objective
a movie that will surely be profane , politically charged music to the ears of cho's fans .	subjective
and the little red light from a laser rifle sight is proof that the caller isn't kidding .	objective
the stunt work is top-notch ; the dialogue and drama often food-spittingly funny .	subjective
the director and her capable cast appear to be caught in a heady whirl of new age-inspired good intentions , but the spell they cast isn't the least bit mesmerizing .	subjective
ain't no mountain high enough to keep the funk brothers from getting to you .	subjective
nicholson's understated performance is wonderful . as warren he stumbles in search of all the emotions and life experiences he's neglected over the years .	subjective
elaborate special effects take centre screen , so that the human story is pushed to one side .	subjective
some people march to the beat of a different drum , and if you ever wondered what kind of houses those people live in , this documentary takes a look at 5 alternative housing options .	subjective
the level of maturity displayed by this 33-year-old first-time feature director is astonishing , considering her inexperience and her subject matter .	subjective
when two african american pilots become the first non-white soldiers in the camp , one turns up murdered and the other accused of killing a white sergeant .	objective
may be far from the best of the series , but it's assured , wonderfully respectful of its past and thrilling enough to make it abundantly clear that this movie phenomenon has once again reinvented itself for a new generation .	subjective
when lucy discovers jack is from the neighborhood she grew up in , she is determined to learn how this man could fall from the comfort of suburbia to living on the streets .	objective
witt plays a young harvard graduate who also represents grant's character .	objective
set against the majestic landscape of canada's bay of fundy and the highest tides in the world , black swan is a dark comedy that weaves the innocent world of childhood , against the adult world of love , betrayal and murder .	objective
though lan yu lacks a sense of dramatic urgency , the film makes up for it with a pleasing verisimilitude .	subjective
disillusioned and with no money the secret knight joins the crusaders and embarks on new adventures .	objective
the council reluctantly admits that they are in a dire situation and they require blade's assistance .	objective
this is a smart movie that knows its classical music , knows its freud and knows its sade .	subjective
maggie's father , yayo , runs a successful bakery , steve is a politician , elena is a fashion designer , ms . al seeks love , conrado is a bashful deliveryman , and mateo is looking for a chance in life .	objective
it is most remarkable not because of its epic scope , but because of the startling intimacy it achieves despite that breadth .	subjective
isabel is a naive provincial lass who works as an indigenous fabric weaver while clara is the liberated city girl .	objective
five screenwriters are credited with the cliché-laden screenplay ; it seems as if each watered down the version of the one before .	subjective
the sort of movie that gives tastelessness a bad rap .	subjective
even if you feel like you've seen this movie a thousand times before , it is kind of enjoyable thanks mainly to belushi's easy-going likableness .	subjective
the elders hope to return home quickly but their new friend has other plans .	objective
a rare mutation has occurred within the vampire community .	objective
while it doesn't expose any new truths about the problems posed by reaching middle age , it reflects wisely on the truths that already exist .	subjective
an epic journey across an unforgiving landscape that will test their very will to survive .	objective
soon , he finds that his fellow patients are being murdered one by one .	objective
the story takes place in rural vermont , against the backdrop of the state capitol , where civil union laws are being debated along with gun control and dwis .	objective
a waterlogged version of 'fatal attraction' for the teeny-bopper set . . . a sad , soggy potboiler that wastes the talents of its attractive young leads .	subjective
a lean , deftly shot , well-acted , weirdly retro thriller that recalls a raft of '60s and '70s european-set spy pictures .	subjective
romy jumps on board with eagle , and takes command , as the pair rescue each other in a tense and action-packed scene .	objective
he is a cop , and chances are he's going to make some trouble for vince too .	objective
when fran , ( paige turco ) walks into the prop house where he lives looking for unusual objects , chep immediately develops a crush .	objective
if signs is a good film , and it is , the essence of a great one is in there somewhere .	subjective
sinks so low in a poorly played game of absurd plot twists , idiotic court maneuvers and stupid characters that even freeman can't save it .	subjective
noyce films it more as a shocking history lesson than as drama .	subjective
but when sy begins spying on the yorkins , he begins to feel that he wants to be in the yorkin's life .	objective
one night , tobias knifes his father in the back , and escape to switzerland .	objective
but when charlie sees mallory with her new boyfriend , curtis , charlie realizes he's been replaced .	objective
like the best war movies -- and like martial literature going back to the iliad -- it balances the dreadful , unassuageable cruelty of warfare and the valor and decency of those who fight .	subjective
the storylines are woven together skilfully , the magnificent swooping aerial shots are breathtaking , and the overall experience is awesome .	subjective
ruled by instant gratification and material desires , they plot to steal a napoleon collection from one of their parents' homes .	objective
how can neil and stevie get out of their mistaken marriages and into each others arms ?	objective
harvard man is a semi-throwback , a reminiscence without nostalgia or sentimentality .	subjective
the story of j whose goal is to be world master at playing nintendo .	objective
the three roommates have proudly scammed their way through the last four years of college and now , during the final exams , these big-men-on-campus are about to be busted by the most unlikely dude in school .	objective
with no job possibilities on the horizon , the two dads open their own day care facility , " daddy day care " , and employ some fairly unconventional and sidesplitting methods of caring for children .	objective
color , musical bounce and warm seas lapping on island shores . and just enough science to send you home thinking .	subjective
he has returned as a ghost , but he can do nothing but passively observe as the police stand clueless to the murder .	objective
this masterfully calibrated psychological thriller thrives on its taut performances and creepy atmosphere even if the screenplay falls somewhat short .	subjective
the film takes place over the course of a day as anthony , victoria , michael and his wife , sarah , spend the afternoon dining , drinking , and soaking in the hot tub .	objective
the case gets more complicated , when even the police themselves appear to become suspects in the murders .	objective
they fool around for a while , but forget to get each other's names down at the end of the night .	objective
there's no denying that burns is a filmmaker with a bright future ahead of him .	subjective
as smoochy catapults to fame - scoring hit ratings and the affections of a jaded network executive randolph makes the unsuspecting rhino the target of his numerous outrageous attempts to exact revenge and reclaim his status as america's sweetheart .	objective
but someone breaks the link before they have finished and now a demon is trapped in their world and the only way to banish it , is for all the people who summoned it to die .	objective
when all seems hopeless , ted gets some guidance from his good friend meg that turns the situation around : " don't scam on her , listen to her , be sincere . "	objective
vega and ulloa give strong performances as the leading lovers and there are some strong supporting turns , particularly from najwa nimri .	subjective
colt seeks the repair of a femininity damaged by an earlier incest .	objective
even if you've seen " stomp " ( the stage show ) , you still have to see this !	subjective
whether you're moved and love it , or bored or frustrated by the film , you'll still feel something .	subjective
while johnny knoxvile and his pals put their life at risk , they are entertaining people at the same time .	objective
the story is about a man , bruce hickman , and his relationship with another man , frank , the thing that they have in common is the relation with a deaf person .	objective
four friends journey dow life's paths to find out whether god or society has the right to decide the good or the evil .	objective
ted norwood summons all his resistance to finally quit his seemingly successful carreer , only to be outmaneuvered by a powerful executive who barely even notices that she's in a test of wills .	objective
working in secret , the progressive group organised the 1959 theatre boycott to end segregation in movie theatres in hamilton .	objective
wise , cruelly observant of human nature and hysterically funny .	subjective
montias . . . pumps a lot of energy into his nicely nuanced narrative and surrounds himself with a cast of quirky -- but not stereotyped -- street characters .	subjective
when carlitos is released after doing 2 years of " hard time " , he attempts to redeem himself and sets an example for his 5 year-old son .	objective
hardly makes the kind of points egoyan wanted to make , nor does it exist as the kind of monument he wanted to build , to victims whose voices have never gained the ears of the world .	subjective
somewhere inside the mess that is world traveler , there is a mediocre movie trying to get out .	subjective
one year later , in los angeles , the surviving team members create a smart and devious plan to steal back the gold and get their revenge on the traitor .	objective
like rudy yellow lodge , eyre needs to take a good sweat to clarify his cinematic vision before his next creation and remember the lessons of the trickster spider .	subjective
this backfires when katie innocently reagles her school with her inside knowledge of carnal pleasures .	objective
the zany search for the shoes begins , as she follows the footsteps through the lively streets of havana , running into the quirky , colorful characters that bring viva zapato and dolore's dream .	objective
a fantastically vital movie that manages to invest real humor , sensuality , and sympathy into a story about two adolescent boys .	subjective
light years/ several warp speeds/ levels and levels of dilithium crystals better than the pitiful insurrection . which isn't to say that it's the equal of some of its predecessors .	subjective
a warm but realistic meditation on friendship , family and affection .	subjective
as it spreads among the friends , their true feelings and personalities emerge as they struggle to survive the virus and each other .	objective
the story alone could force you to scratch a hole in your head .	subjective
what he doesn't expect is to get teamed up with a cocky civilian , world class boxing champion kelly robinson ( eddie murphy ) , on a dangerous top secret espionage mission .	objective
a fascinating literary mystery story with multiple strands about the controversy of who really wrote shakespeare's plays .	subjective
the movie has no respect for laws , political correctness or common decency , but it displays something more important : respect for its flawed , crazy people .	subjective
why sit through a crummy , wannabe-hip crime comedy that refers incessantly to old movies , when you could just rent those movies instead , let alone seek out a respectable new one ?	subjective
joanna , a good-for-nothing girl who miserably failed in her attempt to win any television game show and contest , is hired by nino as his personal secretary , believing that she could be her lucky charm .	objective
a " home alone " film that is staged like " rosemary's baby , " but is not as well-conceived as either of those films .	subjective
cedar takes a very open-minded approach to this sensitive material , showing impressive control , both visually and in the writing .	subjective
in addition , the detective has to deal with a serial killer who had already killed and mutilated many women .	objective
after military service in the gulf war and the former yugoslavia , he returned to his inner city neighborhood to teach at the toughest school in town .	objective
shiner can certainly go the distance , but isn't world championship material	subjective
this is a stunning film , a one-of-a-kind tour de force .	subjective
neighbor's dog operates at a consistent chuckle pitch that frequently gives way to guffaws .	subjective
the game's mastermind has stolen his identity , put him on the fbi's most wanted list , and is blackmailing him to take a part in a real twisted plan of world destruction .	objective
this weekend-sized slice of college life follows the amusing escapades of adam parker and his three closest friends .	objective
enter four months later , when it seems reasonable to say that charlie should be feeling better .	objective
provides an intriguing look at how the new economy has redrawn class lines in contemporary china .	subjective
palm springs' white party is the backdrop for this documentary on the fast-paced world of gay circuit parties .	objective
miyazaki's nonstop images are so stunning , and his imagination so vivid , that the only possible complaint you could have about spirited away is that there is no rest period , no timeout .	subjective
set against the bright lights of manhattan , a tale which takes a comic , urbane look at the modern male ego at war in the singles scene trenches .	objective
the main characters are dr . kanna ( sharad kapoor ) , his fianc&#233 ; e rupi ( ms . nandita das ) , rajayya ( makrand deshpande ) as naxalite commander , inspector despande ( sayaji shinde ) , ghisu ( vijay raj ) and dattu ( rajpal yadav ) .	objective
the mystery of enigma is how a rich historical subject , combined with so much first-rate talent . . . could have yielded such a flat , plodding picture .	subjective
miyazaki is one of world cinema's most wondrously gifted artists and storytellers .	subjective
they get away in their mini coopers , which are small enough to drive on sidewalks so they can make a clean get away before the traffic jam clears .	objective
a film at once depressing and uplifting--depressing in terms of the sad , often horrifying subjects of nachtwey's photographs but uplifting in terms of his commitment and integrity .	subjective
a poignant and gently humorous parable that loves its characters and communicates something rather beautiful about human nature .	subjective
if [jaglom's] latest effort is not the director at his most sparkling , some of its repartee is still worth hearing .	subjective
. . . a light , yet engrossing piece . lux , now in her eighties , does a great combination act as narrator , jewish grandmother and subject  taking us through a film that is part biography , part entertainment and part history .	subjective
i didn't laugh . i didn't smile . i survived .	subjective
the submarine's crew , led by the unyielding captain alexi vostrikov , races against time to prevent a chernobyl-like nuclear disaster which threatens not only the lives of his crew , but has the potential to ignite a world war between the super powers .	objective
well cast and well directed - a powerful drama with enough sardonic wit to keep it from being maudlin .	subjective
the animated subplot keenly depicts the inner struggles of our adolescent heroes - insecure , uncontrolled , and intense .	subjective
simultaneously devastating and hilarious , the film manages to capture the daily rituals and mundanities of life in such engrossing proximity that everything becomes drama .	objective
buries an interesting storyline about morality and the choices we make underneath such a mountain of clichés and borrowed images that it might more accurately be titled mr . chips off the old block .	subjective
what's the most positive thing that can be said about the new rob schneider vehicle ? well , it's not as pathetic as the animal .	subjective
as an entertainment , the movie keeps you diverted and best of all , it lightens your wallet without leaving a sting .	subjective
has something to say . . . but it is a statement and issue worthy of a much more thoughtfulness and insight than a melodramatic and wholly predictable thriller .	subjective
the movie itself is timeless and universal , at once artless and sophisticated in its ability to engross .	subjective
his good looks , charm and overwhelming confidence captured the eye of screen legend norma shearer , who offered him a film role .	objective
drawing from his time with the kids , he writes a story about children who don't want to grow up .	objective
jonathan ecks ( antonio banderas ) , an fbi agent , realizes that he must join with his lifelong enemy , agent sever ( lucy liu ) , a rogue dia agent with whom he is in mortal combat , in order to defeat a common enemy .	objective
yet , beneath an upbeat appearance , she is struggling desperately with the emotional and physical scars left by the attack .	objective
a film full of vivid characters , quiet beauty and gentle grace .	subjective
a fake street drama that keeps telling you things instead of showing them .	subjective
but lulu is newly single and the last thing she needs is a man in her life .	objective
but things are not always what they may look like .	objective
with so many movies out there trying and failing to produce a single honest thrill , it's so nice to see one come along that's packed from start to finish with 'em .	subjective
there's something to be said for a studio-produced film that never bothers to hand viewers a suitcase full of easy answers .	subjective
the only hope is the veritas project , a highly trained investigative team working undercover to expose the truth .	objective
chan's stunts are limited and so embellished by editing that there's really not much of a sense of action or even action-comedy .	subjective
an inexplicable crack in the pyrenees mountains provokes excitement and scientific curiosity .	objective
forced to think fast , the producer decides to digitally create an actress " simone " to sub for the star--the first totally believable synthetic actress .	objective
this time nick is " getting out ! " . . . or	objective
a chaotic panorama that's too busy flying a lot of metaphoric flags .	subjective
after a month , dante comes to see lucy to find out what she has decided .	objective
one of the ring's original bearers , the creature gollum ( andy serkis ) , has tracked frodo and sam down in search of his 'precious' , but is captured by the hobbits and used as a way to lead them to mt .	objective
desert rose is an erotic thriller that takes you through one man's life experience .	objective
a movie more to be prescribed than recommended -- as visually bland as a dentist's waiting room , complete with soothing muzak and a cushion of predictable narrative rhythms .	subjective
sad and alone , caroline wanders the exotic city in search of ansers , finality , and peace of mind .	objective
except shaun runs into one complication after another starting when his application is rejected after his dim-witted guidance counselor sends the wrong application .	objective
the experience of watching blobby old-school cgi animation in this superlarge format is just surreal enough to be diverting .	subjective
. . . skirts the edges of snide condescension only to then abruptly catch the viewer off-guard with lightning strikes of genuine emotion .	subjective
anyone who suffers through this film deserves , at the very least , a big box of consolation candy .	subjective
the tone shifts abruptly from tense to celebratory to soppy .	subjective
set in an american town in the rocky mountains in the 1930s .	objective
so when charlie sees mallory with her new boyfriend , curtis , he goes a bit mad .	objective
he returns with his wife , mercedes , an argentinean he met in spain , and his two adolescent children , mateo and cayetana , born in the same country and forced into a land they know only throught the biased tales of their parents .	objective
static , repetitive , muddy and blurry , hey arnold ! would seem to have a lock on the title of ugliest movie of the year .	subjective
waydowntown is by no means a perfect film , but its boasts a huge charm factor and smacks of originality .	subjective
it's refreshing to see a movie that embraces its old-fashioned themes and in the process comes out looking like something wholly original .	subjective
she has two men in her life : wealthy divorcee ray porter ( steve martin ) and struggling musician jeremy .	objective
a splendid entertainment , young in spirit but accomplished in all aspects with the fullness of spirit and sense of ease that comes only with experience .	subjective
the characters struggle to find love in a world that no longer needs sex to reproduce , a world that is changing and is populated with people who use provisional identities and are seen through virtual selves and a world where love is the only thing that makes things real .	objective
a waste of fearless purity in the acting craft .	subjective
starts as an intense political and psychological thriller but is sabotaged by ticking time bombs and other hollywood-action cliches .	subjective
they're a conveyance true , but they can also become the unlikely place for a rendezvous .	objective
standard story of boy meets girl and girl thinks he is gay .	objective
in this vivid , emotionally complex ensemble piece , korean writer-director jeong jae-eun portrays this extraordinary turning point in every woman's life .	subjective
murder by numbers is like a couple of mediocre tv-movie -of-the-week films clumsily stuck together .	subjective
ramu stands in and repeats the wisdom of sharonna , freeing the mind of the posh guests and attracting lexi to him .	objective
documentary feature about the traditional viennese cinema " bellaria " , which is specialised in german cinema from the 20s , 30s and 40s and its regular customers , whose idols are stars like zarah leander or karl sch&#246 ; nb&#246 ; ck .	objective
the future is on it's way to atlantic city on a bus .	objective
writer/director david caesar ladles on the local flavour with a hugely enjoyable film about changing times , clashing cultures and the pleasures of a well-made pizza .	subjective
along the way she must fend off the unwelcome advances of national tv talk-show host krystal ( with a k ) , her seedy pop svengali phil spectacle , and her enigmatic live-in sidekick dromedary girl ; as well as avoiding detection by natasha , the bewildered international spy with a penchant for inner monologues , who in turn may just bring reinalda's mysterious past back to haunt her one final time . . .	objective
the essential problem in orange county is that , having created an unusually vivid set of characters worthy of its strong cast , the film flounders when it comes to giving them something to do .	subjective
david banner is performing regeneration experiments and uses himself as a guinea pig .	objective
where as many films of this nature linger on the hard , the ugly , the blood , or just the stylistic ; empire focuses on the thinking , the love , and even the light-heartedness , as well as the violence .	subjective
" confessions of a dangerous mind " is the story of a legendary showman's double life - television producer by day , cia assassin by night .	objective
unlike the nauseating fictions peddled by such 'have-yourself-a-happy-little-holocaust' movies as life is beautiful and jakob the liar , the grey zone is honest enough to deny the possibility of hope in auschwitz .	subjective
fans of the tv series will be disappointed , and everyone else will be slightly bored .	subjective
only one person can eventually solve the crisis : stefan balsiger himself .	objective
consider the title's clunk-on-the-head that suggests the overtime someone put in to come up with an irritatingly unimaginative retread concept .	subjective
the movie features veteran horror heroines leslie culton and jenny wallace , and actors john saenz and jonathan tabor .	objective
conveniently numbed and estranged from her surroundings , lillian sleepwalks through life .	objective
