jake , a . k . a . michael turner , has nine days to fill his brother's place .	objective
while the topic has grown heavier here , [moretti's] touch has not , and that disparity is precisely what gives the film its sustained poignancy .	subjective
one of the friends is a dress designer and provides him the artist's clothes and imported cars are provided to him to enjoy life .	objective
through the stories of four different families , daddy &#38 ; papa delves into some of the particular challenges facing gay men who decide to become dads .	objective
the second : a saturday two years later , where charlotte and cecil now a couple , fight , break-up and finally reunite .	objective
with the help of a fellow believer ( hugh mclean ) , and despite several obstacles in the way , he sets out on this mission to fulfill his goal .	objective
but someone has been watching , and they've had enough . . .	objective
now he must battle the courts to get his children back .	objective
the lack of naturalness makes everything seem self-consciously poetic and forced . . . it's a pity that [nelson's] achievement doesn't match his ambition .	subjective
in fact a blueprint : a blueprint of her mother .	objective
[næs] directed the stage version of elling , and gets fine performances from his two leads who originated the characters on stage .	subjective
shot in the spectacular sierra nevada mountains , " the last place on earth " is a funny , moving film about food , passion , love and a one eared dog .	objective
assigned to the vicious in-club slaying of a promising young rap act , the two detective delve into the recording industry where they hope to find answers - ideally ones that also come with property buyers or auditions .	objective
it's weird , wonderful , and not necessarily for kids .	subjective
immigrant worker tobias horvath gets up at 5 : 00 a . m . , washes , shaves , has some breakfast , and runs to the main square .	objective
her constant groans and howls of amorous pleasure turn ted's domain of conquest and libidinous triumph into a nightmare world of bachelorman-interruptus .	objective
the plan's to use the school auto shop to prep two police cars , stash the drugs in secret compartments and drive away safely .	objective
smith examines the intimate , unguarded moments of folks who live in unusual homes -- which pop up in nearly every corner of the country .	subjective
resident evil is what comes from taking john carpenter's ghosts of mars and eliminating the beheadings . in other words , about as bad a film you're likely to see all year .	subjective
here the love scenes all end in someone screaming . maybe there's a metaphor here , but figuring it out wouldn't make trouble every day any better .	subjective
toledo awaits on the street for the exit of ana's lover ( gustavo garz&#243 ; n ) and begins a one-of-a-kind persecution-investigation that will last the whole night , to find out , before confronting him , who is that man and where did he meet ana .	objective
i'm sure the filmmaker would disagree , but , honestly , i don't see the point . it's a visual rorschach test and i must have failed .	subjective
the pleasures that it does afford may be enough to keep many moviegoers occupied amidst some of the more serious-minded concerns of other year-end movies .	subjective
the leads we are given here are simply too bland to be interesting .	subjective
an army of shadows kidnaps anyone who's out after dark and the patrolling thieves make the daylight miserable for everyone .	objective
both the film and nachtwey's photos hammer home the grim reality of the world's gutters and battlefields , and will make you question what 'news' really is .	subjective
the film is small in scope , yet perfectly formed .	subjective
quietly pulls you into its sun drenched style of american gothic in the heartland	subjective
the story is set against a relationship that forms between a runaway american teenage boy and a brazilian teenage girl who meet in the drug and gang controlled slums of rio de janeiro .	objective
tom , a spaniard , is married to sylvie and lives a quiet but a bit boring life in the britanny countryside ( west of france ) .	objective
the animation and game phenomenon that peaked about three years ago is actually dying a slow death , if the poor quality of pokemon 4 ever is any indication .	subjective
but billy still has memories of a wife who cheated on him .	objective
it's refreshing that someone understands the need for the bad boy ; diesel , with his brawny frame and cool , composed delivery , fits the bill perfectly .	subjective
uneven but ultimately appealing satire of the dreck we call white man's rap music . some good performances and an often goofy script make for a generally good time .	subjective
after gruelling training sessions , the three succeed in robbing the bank , but things go haywire .	objective
yeah , she's been hanging with some pretty freaky people and she's tired of their crazy scene and wants out .	objective
a beautiful , entertaining two hours . you get the idea , though , that kapur intended the film to be more than that .	subjective
everyone involved starts getting killed , with mitchell being the next in line .	objective
detective mi yun ( played by yum jung-ah ) , and her newly appointed partner , detective kang ( played by ji jin-hee ) , are assigned to the case .	objective
time changer may not be the most memorable cinema session but its profound self-evaluation message about our fragile existence and the absence of spiritual guidance should at least invade an abundance of mindsets	subjective
by applying definition to both sides of the man , the picture realizes a fullness that does not negate the subject .	subjective
his biggest customers are the yorkin family , and they seem to have everything in the world .	objective
just like the deli sandwich : lots of ham , lots of cheese , with a sickly sweet coating to disguise its excrescence until just after ( or during ) consumption of its second half .	subjective
although he has feelings on the inside , he is only able to mimic the emotions around him .	objective
a classic romance always involves a certain formula : boy meets girl , boy loses girl , boy gets girl . beijing bicycle is a romance , except the love interest is a bicycle and not a girl .	subjective
with some help from otis and the paddy wagon's quirky regulars , among them an angry war vet in a parrot costume and a traveling salesman with a " small " problem , mark finally gets what he deserves .	objective
first and foremost . . . the reason to go see " blue crush " is the phenomenal , water-born cinematography by david hennings .	subjective
j&#243 ; hann is a 30 year old guesthouse owner isolated from the outside world following the death of his father .	objective
there is a knock at the door and mitchell hears his mother asking for t-mon .	objective
during the tuxedo's 90 minutes of screen time , there isn't one true 'chan moment' .	subjective
the only way to be victorious is one must destroy the other .	objective
in addition , various genres of musicians have joined in today showing worldwide support , thus contributing to bruce's objective , 'sure it's nice to be famous , but i'm more interested in obtaining a telepathic following' .	objective
dr . siddharth sinha ( amitabh bachchan ) , a philanthropist and a dedicated surgeon who has devoted his life to build a state-of-the-art hospital to treat the underprivileged patients .	objective
nair's attention to detail creates an impeccable sense of place , while thurman and lewis give what can easily be considered career-best performances .	subjective
munnabhai starts wooing komal but she is in love with raja ( ajay devgan ) , a local vagabond doing nothing except working in a bowling alley as a bouncer .	objective
dogville is shot exclusively in studio with a minimum of props once again allowing the actors' maximum freedom and full exposure inspired by televised theatre of the 70s .	objective
he falls in love with a village girl , ayu , who has just arrived in the city after being betrayed by her boyfriend .	objective
nair doesn't use [monsoon wedding] to lament the loss of culture . instead , she sees it as a chance to revitalize what is and always has been remarkable about clung-to traditions .	subjective
an atonal estrogen opera that demonizes feminism while gifting the most sympathetic male of the piece with a nice vomit bath at his wedding .	subjective
a profoundly stupid affair , populating its hackneyed and meanspirited storyline with cardboard characters and performers who value cash above credibility .	subjective
they find themselves competing for not only the press' attention , but also the focus of their shared lawyer , the suave billy flynn .	objective
what would have otherwise been a routine nostalgic coming-of-ager takes on a new , innovative form .	subjective
smart , sassy interpretation of the oscar wilde play .	subjective
it'll keep you wide awake and . . . very tense .	subjective
gino and settimo try to repay roberto's hospitality by chasing off a debt collector who wants his property , but their strong arm tactics alarm him and he realises they aren't the pr consultants they claimed to be liquor store night clerk jose ( freddie ganno ) has two dreams : winning the state lottery and winning the heart of a lovely young shoe store salesperson , diana ( christi adams ) .	objective
to vaughn , lena embodies the society that has rejected him .	objective
. . . there's a choppy , surface-effect feeling to the whole enterprise .	subjective
bret has an idea that will push them both across lines they'd never seriously considered crossing .	objective
tough detective mike reilly collaborates with department of health associate terry huston to research these mysterious deaths .	objective
after several scenes of this tacky nonsense , you'll be wistful for the testosterone-charged wizardry of jerry bruckheimer productions , especially because half past dead is like the rock on a wal-mart budget .	subjective
a fast-paced look into the world of underground street-racing .	objective
the dea finally convinces the chinese military that robert may be of more help to them outside jail by leading them to the real smugglers .	objective
they become the most dreaded monsters of our imagination .	objective
in the end , the film feels homogenized and a bit contrived , as if we're looking back at a tattered and ugly past with rose-tinted glasses .	subjective
a cold-hearted judge finds out when a seemingly crazy young couple break into his house and take him captive .	objective
shot independently over a 24-hour period , the film is first a witness to the fall of the twin towers , as a line of fire and a buckle in the armature signal imminent collapse .	objective
this is presumably a somewhat true story , as charlie kaufman is the real life screenwriter of adaptation .	objective
johnny knoxville and his crazy friends appear on the big screen for the very first time in jackass : the movie .	objective
this was also a time , in the midst of a chaotic , decaying environment , when a man tried to cope with the loss of his former lover .	objective
' . . . both hokey and super-cool , and definitely not in a hurry , so sit back , relax and have a few laughs while the little ones get a fuzzy treat . '	subjective
after exhausting all conventional resources , he reluctantly visits a mystic who offers to show him three " visions " of his son's life .	objective
the cast , collectively a successful example of the lovable-loser protagonist , shows deft comic timing .	subjective
now , after five years of calling the shots-on everything from his clothes to his divorce settlements - lucy kelson is calling it quits .	objective
otjen is helming the pic , holly mosher produces .	objective
such a talent makes fabbrizio the kidnapping target of his former arch-enemy devlin bowman , a criminal mastermind .	objective
despite cramming in numerous clichés , mehta still manages to put a fresh and funny spin on the proceedings .	subjective
beautifully crafted and brutally honest , promises offers an unexpected window into the complexities of prejudice .	subjective
renée zellweger , catherine zeta-jones , richard gere , queen latifah and even sad-faced ol' john c . reilly will have you singin' and dancin' in the aisles .	subjective
belleza , magia , poder , amor , misterio , y gran gran música y visuales . . . ¿qué más se puede pedir ? . . .	subjective
. . . a visually seductive , unrepentantly trashy take on rice's second installment of her vampire chronicles .	subjective
especially one of them , holo tokyo boy , was designed to be her lover .	objective
too restrained to be a freak show , too mercenary and obvious to be cerebral , too dull and pretentious to be engaging . . . the isle defies an easy categorization .	subjective
he speaks villon's poet " i fell in love with your red hair " .	objective
a terrific insider look at the star-making machinery of tinseltown .	subjective
any film featuring young children threatened by a terrorist bomb can no longer pass as mere entertainment .	subjective
her family doctor is baffled ; his examination reveals her story to be true !	objective
horace seeks the repair of his masculine identity damaged by a partner who won't make love to him .	objective
nicholas is immediately drawn to this gruesome bobby , and begins to secretly take care of the creature .	objective
though tom shadyac's film kicks off spookily enough , around the halfway mark it takes an abrupt turn into glucose sentimentality and laughable contrivance .	subjective
how has the " excitement " of the 70's turned into the " blandness " of today ?	objective
turning a great movie into a pretty good one is still a step in the wrong direction . . . and the ring will never be more than a pretty good movie .	subjective
the following things are not at all entertaining : the bad sound , the lack of climax and , worst of all , watching seinfeld ( who is also one of the film's producers ) do everything he can to look like a good guy .	subjective
when joe , a us navy seal , and katsuragi , a japanese detective , join forces to stop the circulation of blood heat , they are taken to an underground martial arts tournament in the muscle dome held by the yakuza and triads , where the fighters are blood heat users .	objective
brookdale has another , more lucrative facet ; a safe harbour for the chronically drug-addicted rich and famous , especially the sons and daughters of the above , whose families have tried everything .	objective
the way home is an ode to unconditional love and compassion garnered from years of seeing it all , a condition only the old are privy to , and . . . often misconstrued as weakness .	subjective
when a humans camp is attacked by tigers , a woman takes her baby and jumps on a river .	objective
the film is an homage to power , strength and individualism .	objective
three teenagers hit a homeless girl with their car , scared , they drive away , leaving the girl to die on the streets .	objective
it's as if a bored cage spent the duration of the film's shooting schedule waiting to scream : " got aids yet ? "	subjective
the story is set during the american revolution in the late 1700's , when america fought for it's independence from britain .	objective
toledo arrives home and has a long conversation with ana , who constantly manifests a ridiculous desire of 'going out for a drink' .	objective
the sweetest thing is expressly for idiots who don't care what kind of sewage they shovel into their mental gullets to simulate sustenance .	subjective
after the fellowship has broken , merry and pippin , taken by orcs , make new allies in the ents , while legolas , gimli and aragorn make allies in the people of rohan , and all of them must launch an assault on isengard .	objective
a unique and irreverent look at new york's cubicle filled sweatshops .	objective
if this dud had been made in the '70s , it would have been called the hills have antlers and played for about three weeks in drive-ins .	subjective
evelyn may be a weightless picture , but it's hardly torture to sit through .	subjective
the script , the gags , the characters are all direct-to-video stuff , and that's where this film should have remained .	subjective
one just waits grimly for the next shock without developing much attachment to the characters .	subjective
no better or worse than 'truth or consequences , n . m . ' or any other interchangeable actioner with imbecilic mafia toolbags botching a routine assignment in a western backwater .	subjective
christians sensitive to a reductionist view of their lord as a luv-spreading dr . feelgood or omnipotent slacker will feel vastly more affronted than secularists , who might even praise god for delivering such an instant camp classic .	subjective
but our wet hero isn't dead , and soon finds himself in zurich .	objective
shattering , devastating documentary on two maladjusted teens in a downward narcotized spiral . extraordinary debut from josh koury .	subjective
schütte's dramatic snapshot of the artist three days before his death offers an interesting bit of speculation as to the issues brecht faced as his life drew to a close .	subjective
the result is a high-stakes mystery , where everyone seems to know exactly who is most guilty .	objective
( wendigo is ) why we go to the cinema : to be fed through the eye , the heart , the mind .	subjective
but when those worlds collide , taking the lives of his wife and younger son , sullivan and his surviving son , michael jr . , leave their sedate home life behind and embark on a startling journey of revenge .	objective
alex enlists the aid of his old comrade father thomas ( addy ) and of a troubled artist ( sossamon ) upon whom he once performed an exorcism .	objective
he can do anything but when he discovers others in buffalo who are praying , he learns that maybe this job of being god isn't really that easy .	objective
when she suddenly disappears he travels down to london to search for her only to discover that she has three identities - dancer , dominatrix and con-woman .	objective
this film is difficult to watch for the inhumanity it depicts , but important to see for its factual elements and the reminder of both the difficulty and importance of maintaining one's humanity .	subjective
based on an acclaimed 1935 novel about the war of liberation ( 1918-1920 ) that ensured estonia's independence , the film tells about a group of young schoolboys heading to the front to fight the army of soviet russia .	objective
perhaps the most remarkable aspect of murderous maids is how restrained and sensitive french director jean-pierre denis keeps his film .	subjective
from its nauseating spinning credits sequence to a very talented but underutilized supporting cast , bartleby squanders as much as it gives out .	subjective
but someone else has also returned to campus , and with a darker and altogether bloodier purpose in mind .	objective
fearful of the repercussions on his already messed up life , greg flees the scene and manages to hide his clunky damaged truck on the nearby overgrown farm of martha thompson , an aging grouchy widow who lives by the scriptures , ideas of traditional family and her trusty shotgun .	objective
director rob marshall went out gunning to make a great one .	subjective
rupi who is totally devoted to kanna does try to convince ghisu .	objective
once there , she finds more than she expected .	objective
extremes of intimacy and spectacle , tragedy and hope fuse in a tidal wave of visuals and music , giving rise to a unique , artistic experience that reflects the vision of a brave new globalized world .	objective
an original little film about one young woman's education .	subjective
however to keep the image of him as a sex guru going he has to get more lessons from sharonna whom he begins to fall for despite using her .	objective
thus when he surprisingly gets an email from american film producer alex brubeck who writes that he had liked the script and would like to meet him personally , tam&#225 ; s sees all his dreams come true .	objective
quick pace , no lulls , many silly bits and a soundtrack that knows how to back this kind of satirical comedy	subjective
the woods haven't been this creepy since the blair witch project .	subjective
a young great gatsbyish hip hopper named summer g falls for a middle to upper class sister while in college .	objective
a classy item by a legend who may have nothing left to prove but still has the chops and drive to show how its done .	subjective
the story and characters are nowhere near gripping enough .	subjective
with no other leads , claire warily sets out with miles towards tiburon , a secret community outside the city that may be the last hold-out against the drug . . .	objective
it is the weekend and the lottery office is closed .	objective
about amy's cuteness , amy's career success ( she's a best-selling writer of self-help books who can't help herself ) , and amy's neuroses when it comes to men .	subjective
starting off small , dealing to the high school and college market , kilo discovers the drug business to be very profitable .	objective
little does he know , he is investigating some of the biggest events of the star wars saga , as he finds out that there is a connection between the assassination attempts and a separtists movement led by a former jedi ( christopher lee ) against the republic .	objective
has taken serious note of the situation and special task force is sent to the jungle to deal with naxal problem .	objective
a bittersweet contemporary comedy about benevolent deception , which , while it may not rival the filmmaker's period pieces , is still very much worth seeing .	subjective
the hard-to-predict and absolutely essential chemistry between the down-to-earth bullock and the nonchalant grant proves to be sensational , and everything meshes in this elegant entertainment .	subjective
believing himself capable of understanding people from the other side of the track , michael fails to recognize that the ex-con is manipulating him and so sets off a catastrophic chain of events in the community .	objective
the talented and clever robert rodriguez perhaps put a little too much heart into his first film and didn't reserve enough for his second .	subjective
on new year's eve , 1969 , a flamboyant ragtag troupe of genderbending hippies took the stage of san francisco's palace theater and the cockettes were born .	objective
with spy kids 2 : the island of lost dreams , the spy kids franchise establishes itself as a durable part of the movie landscape : a james bond series for kids .	subjective
is anyone else out there getting tired of the whole slo-mo , double-pistoled , ballistic-pyrotechnic hong kong action aesthetic ?	subjective
it reminds us that nathan lane is the best show stealer in show business .	subjective
however when he finds it's in a porno with actress sharonna he can't go through with it despite her good advice on how to do it .	objective
reign of fire just might go down as one of the all-time great apocalypse movies .	subjective
her harrowing story ends in victory , but she has not forgotten the thousands of asylum seekers who remain in detention today .	objective
shae powell , a successful single mom , wakes up rattled from a horrible dream .	objective
a moving and stark reminder that the casualties of war reach much further than we imagine .	subjective
seldom has a movie so closely matched the spirit of a man and his work .	subjective
a former eastern germany secret agent runs away fron his past and lands in m&#233 ; xico under a fake identity .	objective
the four reluctantly come together when they have to return a human child to its father while braving the deadly elements of the impending ice age .	objective
improves when it takes a more serious tone and zaza and judith develop into deeper characterizations .	subjective
a bad day becomes worse by the hour and to top it off , the toilet won't flush .	objective
a universally accessible family fantasy with a stronger sense of its time and place than most live-action films can claim .	subjective
this is cruel , misanthropic stuff with only weak claims to surrealism and black comedy .	subjective
the unexpected result demonstrates ignored wills do not remain invisible forever .	objective
as violent , profane and exploitative as the most offensive action flick you've ever seen .	subjective
. . . surprisingly inert for a movie in which the main character travels back and forth between epochs .	subjective
something akin to a japanese alice through the looking glass , except that it seems to take itself far more seriously .	subjective
such a wildly uneven hit-and-miss enterprise , you can't help suspecting that it was improvised on a day-to-day basis during production .	subjective
the story . . . is inspiring , ironic , and revelatory of just how ridiculous and money-oriented the record industry really is . it is also a testament to the integrity and vision of the band .	subjective
take care of my cat offers a refreshingly different slice of asian cinema .	subjective
this story of a determined woman's courage to find her husband in a war zone offers winning performances and some effecting moments .	subjective
a postal worker has some lunch in a chinese restaurant and falls in love with the waitress , who happens to be chinese .	objective
when they come through , will is left with a decision .	objective
shanghai ghetto may not be as dramatic as roman polanski's the pianist , but its compassionate spirit soars every bit as high .	subjective
adding to the situation is a killer hurricane bearing down on the island .	objective
devoid of any of the qualities that made the first film so special .	subjective
