armed with a game supporting cast , from the pitch-perfect forster to the always hilarious meara and levy , like mike shoots and scores , doing its namesake proud .	subjective
they've known each other since they met as children , when both discovered hip-hop for the first time .	objective
pan nalin's exposition is beautiful and mysterious , and the interviews that follow , with the practitioners of this ancient indian practice , are as subtle and as enigmatic .	subjective
long before the first exorcist , we are taken to the birth of the demon pazuzu , and follow him through his life , eventually bringing us to the middle east where he waits for a victim to use as a vehcile to destroy the world with .	objective
it is as uncompromising as it is nonjudgmental , and makes clear that a prostitute can be as lonely and needy as any of the clients .	subjective
years later murdock has grown into a man and becomes a respected criminal attorney .	objective
though he tried to maintain a life of solitude , he is soon entangled with an artist who is struggling with a personal tragedy and an overly-friendly cuban hot dog vendor .	objective
her maid of honor says she's got to call off the wedding , but that proves much more difficult than expected .	objective
few films have captured the chaos of an urban conflagration with such fury , and audience members will leave feeling as shaken as nesbitt's cooper looks when the bullets stop flying .	subjective
it doesn't make for great cinema , but it is interesting to see where one's imagination will lead when given the opportunity .	subjective
gary oldman plays as a dwarf brother to a normal-sized matthew mcconaughey .	objective
two college grads land an entry level mafia job driving a retiring don's car cross country .	objective
[dong] makes a valiant effort to understand everyone's point of view , and he does such a good job of it that family fundamentals gets you riled up .	subjective
miller is playing so free with emotions , and the fact that children are hostages to fortune , that he makes the audience hostage to his swaggering affectation of seriousness .	subjective
facing death of his friends , major korenev decides to re-install law and order using some unorthodox methods that are only relevant in 21st century russia .	objective
inside the film's conflict-powered plot there is a decent moral trying to get out , but it's not that , it's the tension that keeps you in your seat . affleck and jackson are good sparring partners .	subjective
a dopey movie clothed in excess layers of hipness .	subjective
it stars schticky chris rock and stolid anthony hopkins , who seem barely in the same movie . their contrast is neither dramatic nor comic -- it's just a weird fizzle .	subjective
poignant and moving , a walk to remember is an inspirational love story , capturing the innocence and idealism of that first encounter .	subjective
the director seems to take an unseemly pleasure in [the characters'] misery and at the same time to congratulate himself for having the guts to confront it .	subjective
it's tommy's job to clean the peep booths surrounding her , and after viewing this one , you'll feel like mopping up , too .	subjective
with a single clue to their whereabouts and nothing to lose , he leaves to find 'his people' .	objective
a crisply made movie that is no more than mildly amusing .	subjective
a diverse and astonishingly articulate cast of palestinian and israeli children .	subjective
in the throes of falling for one another , they are soon forced to deal with the bitter realities of their lives prior to that chance encounter .	objective
tackles the difficult subject of grief and loss with such life-embracing spirit that the theme doesn't drag an audience down .	subjective
if you like blood , guts and crazy beasts stalking men with guns though . . . you will likely enjoy this monster .	subjective
using only a phone , a polaroid camera and his wits , he reclaims control over his life , transforming himself from pawn to puppet master in a wicked tale of revenge .	objective
die another day is only intermittently entertaining but it's hard not to be a sucker for its charms , or perhaps it's just impossible not to feel nostalgia for movies you grew up with .	subjective
uma thurman stars in quentin tarantino's fourth film venture , kill bill .	objective
suffers from unlikable characters and a self-conscious sense of its own quirky hipness .	subjective
of course , deeds' sincere naivet&#233 ; has babe falling in love with him instead .	objective
an interview with rick rescorla , head of security for morgan stanley dean witter , filmed in his office on the 44th floor of the world trade center in 1998 .	objective
they team up and live their lives in the fast lane on the run .	objective
loonies is a touching comedy about five psychiatric patients who are forced to exchange their familiar surroundings for an old-fashioned , impersonal institution .	objective
but roger's seemingly foolproof world of smooth talk and casual sex begins to unravel when he is paid a surprise visit by his teenager nephew , nick .	objective
television made him famous , but his biggest hits happened off screen .	objective
years after escaping to the wastelands outside the city , claire , one of the few people left who is not an addict , returns looking for the one man who still matters to her .	objective
they are told the story of the chamber of secrets .	objective
soderbergh skims the fat from the 1972 film . what's left is a rich stew of longing .	subjective
he is again shocked to see the wife , she is deeksha .	objective
a moving story of determination and the human spirit .	subjective
pacino , connery , de nero , schwarzenegger - together on film - for the first time . . .	objective
like it or not , anne marie starts losing her balance - and finding it - as she falls for matt .	objective
as a woman who can let go of her need to be in control .	objective
they will live without thinking in the consequences , getting into a world where they won't be able to escape .	objective
during the year 2000 geyrhalter and his teams travelled to a different destination each month , looking for places untouched by the millennium hysteria .	objective
katie is a young girl who loves to climb .	objective
werner , a sniper and ex-legionnaire , presently a mercenary , who has seen it all , from angola to sarajevo .	objective
as is most commonly case with projects such noble and lofty ambitions , the film is less poetic than simply pretentious .	subjective
as the sulking , moody male hustler in the title role , [franco] has all of dean's mannerisms and self-indulgence , but none of his sweetness and vulnerability .	subjective
chalk it up as the worst kind of hubristic folly .	subjective
a mass of weary knights , squires , soldiers of fortune and priests are making their way home across a europe that has changed forever .	objective
a well-crafted film that is all the more remarkable because it achieves its emotional power and moments of revelation with restraint and a delicate ambiguity .	subjective
perceptive in its vision of nascent industrialized world politics as a new art form , but far too clunky , didactic and saddled with scenes that seem simply an ill fit for this movie .	subjective
20 , 000 years before , our planet is entering an ice age .	objective
the screenwriters dig themselves in deeper every time they toss logic and science into what is essentially a " dungeons and dragons " fantasy with modern military weaponry . . .	subjective
a real audience-pleaser that will strike a chord with anyone who's ever waited in a doctor's office , emergency room , hospital bed or insurance company office .	subjective
a mobster's wife is forced to confront her dark side when her young child is kidnapped and held for ransom .	objective
through his addiction to these ardent visions , he becomes more reclusive .	objective
to the outside , he is a faithful servant and a fierce protector of the organization , but inside he is full of doubt .	objective
eric byler's nuanced pic avoids easy sentiments and explanations . . .	subjective
charged with as much psychological depth as gun-slinging violence , johnny to and wai ka fai's slick thriller brought a welcome jolt of adrenaline to the moribund hong kong action genre .	subjective
this eruption of bloody violence becomes the catalyst for the unleashing of dark forces with terrifying results .	objective
nic is fixated on getting laid , and watches mike and nadine through the skylight with josh .	objective
in its treatment of the dehumanizing and ego-destroying process of unemployment , time out offers an exploration that is more accurate than anything i have seen in an american film .	subjective
on an african safari , eliza thornberry discovers that thanks to a shaman , she can now talk to animals .	objective
armed with a rad '80s soundtrack and a winning cast ( including indie rocker liz phair ) , cherish is an ingenious low-budget thriller .	subjective
i was perplexed to watch it unfold with an astonishing lack of passion or uniqueness .	subjective
however after roxie has undergone the 'casting couch' treatment , and fred has had his wicked way with her , he reveals that he has no more connections in showbusiness than she does .	objective
unfortunately , the evil tall man ( angus scrimm ) controls that area .	objective
an entertaining and topical adventure drama which responds to our society's fascination with doomsday cults , survivalist sects and their messianic leaders .	objective
the face of the serpent is an action-thriller with strong political undertones of local government corruption .	objective
contains the humor , characterization , poignancy , and intelligence of a bad sitcom .	subjective
who is this movie for ? not kids , who don't need the lesson in repugnance . it's also not smart or barbed enough for older viewers -- not everyone thinks poo-poo jokes are 'edgy . '	subjective
a movie that tries to fuse the two 'woods' but winds up a bolly-holly masala mess .	subjective
leading a double life in an american film only comes to no good , but not here . matters play out realistically if not always fairly .	subjective
vividly conveys the shadow side of the 30-year friendship between two english women .	subjective
people on the site work monotonously , in a fervor , then dazed , trance-like .	objective
jenny even turns to the flower girl - who isn't much help .	objective
the huskies are beautiful , the border collie is funny and the overall feeling is genial and decent .	subjective
hill looks to be going through the motions , beginning with the pale script .	subjective
alas , the black-and-white archival footage of their act showcases pretty mediocre shtick .	subjective
a visual spectacle full of stunning images and effects .	subjective
the couch - considered holy because certain hasidic rabbis had slept on it - survived wwii and is in the filmmaker's great grandfather's house in rohod , a northeast hungarian town .	objective
basically a static series of semi-improvised ( and semi-coherent ) raps between the stars .	subjective
take a friend ( invisible or real ) to see this one . . . it's laugh out loud funny	subjective
just about the best straight-up , old-school horror film of the last 15 years .	subjective
before long , the bay boy of bowls is turning the sedate and very english pastime upside down with hysterical results .	objective
even though it is infused with the sensibility of a video director , it doesn't make for completely empty entertainment	subjective
overall tomfoolery like this is a matter of taste .	subjective
or so he thinks until the blackmailer pulls a u-turn on rodney .	objective
when she finally realizes she will never be free with edgar , never have again what they had once , she must make a life and death decision .	objective
connie sumner has a loving husband , a beautiful home , and a wonderful son , but she wants more .	objective
" an entire film about researchers quietly reading dusty old letters . "	subjective
all the more disquieting for its relatively gore-free allusions to the serial murders , but it falls down in its attempts to humanize its subject .	subjective
wanker goths are on the loose ! run for your lives !	subjective
isn't as sharp as the original . . . despite some visual virtues , 'blade ii' just doesn't cut it .	subjective
in painting an unabashedly romantic picture of a nation whose songs spring directly from the lives of the people , the movie exalts the marxian dream of honest working folk , with little to show for their labor , living harmoniously , joined in song .	subjective
that's why handsome and his three best friends sammy , victor and the cribsheet genius applebee have banded together and found ways to cheat on their tests all through their school years .	objective
finnur , a 9 year old boy , finds his way to j&#243 ; hanns world and they develop a special friendship .	objective
if high crimes were any more generic it would have a universal product code instead of a title .	subjective
just like any other elevator in any old building .	objective
but as documentary filmmaker , zeus papagianakopoulous , is about to find out , the real story took place when the cameras weren't rolling .	objective
far from heaven is a dazzling conceptual feat , but more than that , it's a work of enthralling drama .	subjective
the feeling of each vision changes drastically as does the way the son looks and acts .	objective
like brosnan's performance , evelyn comes from the heart .	subjective
international news media baron , rupert murdoch ( played by ben mendelsohn ) , then publisher of the adelaide " news , " became the driving force behind securing a re-trial for stuart .	objective
but this time , they're gonna have to face both the police - and the mafia !	objective
suffocated at conception by its munchausen-by-proxy mum . punish the vehicle to adore the star .	subjective
'lovely and amazing , ' unhappily , is neither . . . excessively strained and contrived .	subjective
in this emotionally compelling documentary , sister helen opens a private home for recovering addicts and alcoholics in the south bronx after the death of her husband and two sons .	objective
she feels left out from her father's new family , she's had an abortion , she's tried to commit suicide , and she hates life in the city .	objective
hassan ii busc&#243 ; el momento preciso para organizar la verbenesca &#171 ; marcha verde&#187 ; que colocaba a nuestro ej&#233 ; rcito ante una disyuntiva grav&#237 ; sima .	objective
a young korean war veteran returns home to find his parents have died and his wife has left him for another man .	objective
adopting the name " spider-man " , peter first uses his newfound powers to make money , but after his uncle is murdered at the hands of a criminal peter failed to stop , he swears to use his powers to fight the evil that killed his uncle .	objective
this rough but extraordinary film presents a haunting picture of life in kurdistan .	subjective
a " popular yet mean-spirited " teenage girl wakes up one day to find herself turned into a man in his 30's ( schneider ) .	objective
exhibits the shallow sensationalism characteristic of soap opera . . . more salacious telenovela than serious drama .	subjective
the advantage of a postapocalyptic setting is that it can be made on the cheap . any rock pile will do for a set . reign of fire has the disadvantage of also looking cheap .	subjective
kimberly corman , 19 , was just taking a trip with her friends . .	objective
the film's strength isn't in its details , but in the larger picture it paints - of a culture in conflict with itself , with the thin veneer of nationalism that covers our deepest , media-soaked fears .	subjective
this roller coaster tale teams a young man , will turner , with an unlikely ally in rogue pirate jack sparrow .	objective
denied political-prisoner-of-war status , he initiates a hunger strike .	objective
after she rejects him for a fellow social climber , summer g spends ten years building a hip hop empire , then moves to the hamptons where he finds the object of his affections .	objective
beautifully acted , smart and funny . it steers clear of being a maudlin soap opera normally found on lifetime .	subjective
a little more intensity and a little less charm would have saved this film a world of hurt .	subjective
truth is stranger than fiction , so the old saying goes . in 'catch me if you can , ' it's also more entertaining .	subjective
one of the year's most weirdly engaging and unpredictable character pieces .	subjective
after returning home from a two week trial in chicago , rachel bishop ( rachel nord ) finds her sister emily bishop ( nancy walters ) missing .	objective
even if britney spears is really cute , her movie is really bad .	subjective
the girls have unwittingly botched up a diamond delivery to the middle east .	objective
he forgets most things after only a few minutes .	objective
broomfield reveals an ironic manifestation of institutionalized slavery that ties a black-owned record label with a white-empowered police force .	subjective
merchant effectively translates naipaul's lively mix of characters from the page to screen .	subjective
an abused woman ( lopez ) discovers that the dream man ( campbell ) she married wasn't whom she thought he was .	objective
so riddled with unanswered questions that it requires gargantuan leaps of faith just to watch it plod along .	subjective
at its heart and most importantly , spirited away concerns a little girl learning to honour her friends and her family by valuing herself .	subjective
stone seems to have a knack for wrapping the theater in a cold blanket of urban desperation .	subjective
the tucks have a secret , they're immortal . they	objective
he follows them into a cave with a mysterious blue light and it turns out he is following h . g . wells , who , in turn , is on a time travel chase of dr . noah , a brilliant scientist who has gone mad with the intentions on destroying the world .	objective
crumbling yerba city stands empty , except for its drug-parlors , where the remnants of the population cluster , drifting towards oblivion .	objective
blade ii is as estrogen-free as movies get , so you might want to leave your date behind for this one , or she's gonna make you feel like you owe her big-time .	subjective
the only thing in pauline and paulette that you haven't seen before is a scene featuring a football field-sized oriental rug crafted out of millions of vibrant flowers .	subjective
if you saw benigni's pinocchio at a public park , you'd grab your kids and run and then probably call the police .	subjective
she works at a pet clinic and lives alone with her only " true friend " ; a doll her mother gave her when she was a little girl .	objective
the problems of the people in love in the time of money are hardly specific to their era . they just have problems , which are neither original nor are presented in convincing way .	subjective
i like my christmas movies with more elves and snow and less pimps and ho's .	subjective
then she buys a bar of chocolate from the neighborhood store . . .	objective
that rare film whose real-life basis is , in fact , so interesting that no embellishment is needed .	subjective
. . . " bowling for columbine " remains a disquieting and thought-provoking film . . .	subjective
a cogent yet hilarious indictment of our soul-destroying urban existence .	subjective
both grant and hoult carry the movie because they are believable as people -- flawed , assured of the wrong things , and scared to admit how much they may really need the company of others .	subjective
this is a visually stunning rumination on love , memory , history and the war between art and commerce .	subjective
tins is a glamour doll who is the one person who can help arjun get what he wants .	objective
lucy walks away from him , deciding to take time to make this decision for herself .	objective
when he does this , he finds out that freddy is killing th kids of crystal lake in they're dreams !	objective
succeeds very well in its primary aim of making us gasp .	subjective
a delightful entree in the tradition of food movies .	subjective
'ejemplo de una cinta en que no importa el talento de su reparto o lo interesante que pudo haber resultado su premisa , pues el resultado es francamente aburrido y , por momentos , deplorable . '	subjective
steven's outlandish plan inevitably backfires , and hilarity ensues as they fall for each other but are unable to express their true feelings .	objective
when not wallowing in its characters' frustrations , the movie is busy contriving false , sitcom-worthy solutions to their problems .	subjective
as he spirals into a series of hallucinations , the line between his sister's death and ellen's disappearance blurs .	objective
the protagonist , sally amonte , is still mourning the loss of her deceased husband and though she is young and beautiful , has resigned herself to working in the textile mill , caring for her elderly mother , and worrying about her rebellious teenage daughter .	objective
behan himself knew how to spin a tale and one can't help but think he'd appreciate this attempt to turn his life into art .	subjective
serry does a fine job of capturing the climate of the times and , perhaps unwittingly , relating it to what is happening in america in 2002 . but hard-to-believe plot twists force the movie off track in its final half hour .	subjective
the movie provides an intimate glimpse of how sensibilities as compatible as oil and water forced themselves to blend and create a successful work despite their aesthetic differences .	subjective
jordan is a mom who is on a life long search for true faith as she tries to protect her only child from what she believes is injustice .	objective
we never really feel involved with the story , as all of its ideas remain just that : abstract ideas .	subjective
after running circles , dave , trudy , and jolynn find with the light of a new day the lives they been meaning to live .	objective
the story is set in a place called attic town , where the great syndicate robs and kills anyone who stands in their way .	objective
meanwhile an unspoken attraction develops between joe and ella , heightening the claustrophobic tensions in the confined space of the barge .	objective
a story of love and enchantment set in the coldest of winters , it explores the issues , dilemmas and barriers facing the lucky and unlucky in love in the 21st century , based on the novel of the same name by pullitzer prize-winning author carol shields .	objective
content merely to lionize its title character and exploit his anger - all for easy sanctimony , formulaic thrills and a ham-fisted sermon on the need for national health insurance .	subjective
davis has filled out his cast with appealing fresh faces .	subjective
this story is a heartbreaking look into the addiction of smoking and its consequences to the loved ones of the smoker .	objective
in its ragged , cheap and unassuming way , the movie works .	subjective
jenny must fight to earn her scholarship and try to find a balance between the man of her faith and the man of her dreams .	objective
comedic high jinks ensue as the two go on the lam and start to fall in love .	objective
the next morning , their friday gets freaky when tess and anna find themselves inside the wrong bodies .	objective
cockettes has the glorious , gaudy benefit of much stock footage of those days , featuring all manner of drag queen , bearded lady and lactating hippie .	subjective
sara , recently divorced and mourning the loss of her only child , rents her basement to bogdan , a serbian musician who brings the whole band along .	objective
the son winds up re-creating his father's elusive life in a series of legends and myths inspired by the few facts he knows .	objective
most fish stories are a little peculiar , but this is one that should be thrown back in the river .	subjective
imperfect ? yes , but also intriguing and honorable , a worthwhile addition to a distinguished film legacy .	subjective
there is no pleasure in watching a child suffer . just embarrassment and a vague sense of shame .	subjective
an alcoholic former schoolteacher hired as security finds himself a reluctant mentor to mouse , the impressionable boy ward of the pimp dewey .	objective
never quite transcends jokester status . . . and the punchline doesn't live up to barry's dead-eyed , perfectly chilled delivery .	subjective
the pianist is the film roman polanski may have been born to make .	subjective
a hit man from the same mob is sent to kill sullivan and his family , but only kills his wife and son , peter .	objective
the man who kidnapped his daughter is also doing what he can to find them .	objective
the performances are amiable and committed , and the comedy more often than not hits the bullseye .	subjective
their parents , miffed by this , decide to go and kidnap st . nick , unaware that their plan will soon backfire upon them in fun and happy ways .	objective
a counterfeit 1000 tomin bank note is passed in a bazaar .	objective
in the name of an allegedly inspiring and easily marketable flick , the emperor's club turns a blind eye to the very history it pretends to teach .	subjective
the main story . . . is compelling enough , but it's difficult to shrug off the annoyance of that chatty fish .	subjective
a spiffy animated feature about an unruly adolescent boy who is yearning for adventure and a chance to prove his worth .	subjective
alternative medicine obviously has its merits . . . but ayurveda does the field no favors .	subjective
if this movie leaves you cool , it also leaves you intriguingly contemplative .	subjective
jake had no idea he had a twin brother , let alone that he worked for the cia .	objective
