amidst the ever continuous vitality of america , the color photograph , eve yearns for a stillness , a black and white print that will soothe her soul .	objective
this is a man's man , a ladies man , a super-hero : he's ted davis : " bachelorman " when the woman of his dreams , " heather " moves in next door , ted's ordeal begins .	objective
the film culminates with the band's arrival on the u . s . stage at wolf trap national park .	objective
when algren is injuried and captured by the samurai , learns about their warrior honor code from katsumoto , the samurai&#180 ; s leader and decide which side of the conflict he wants to be on . . .	objective
amazing ? not quite . but this film sure is lovely .	subjective
not only is it a charming , funny and beautifully crafted import , it uses very little dialogue , making it relatively effortless to read and follow the action at the same time .	subjective
young is a tribute to the nobility of those men under fire , their common acts of uncommon valor , and their loyalty to and love for one another .	objective
overall very good for what it's trying to do .	subjective
his big brother george has also made a new friend , will , so stuart is feeing lonely .	objective
bravely explores the psychic damage inflicted on jean-luc by a withholding , then absent parent .	subjective
and with the birth of tiz's son , it becomes unavoidably evident that tiz's fate and his hopes for success involve far more than just his own happiness .	objective
jack , a lonely driver on a desert highway , runs out of gas .	objective
a beyond-lame satire , teddy bears' picnic ranks among the most pitiful directing debuts by an esteemed writer-actor .	subjective
[fiji diver rusi vulakoro and the married couple howard and michelle hall] show us the world they love and make us love it , too .	subjective
veteran actor serrault and rising newcomer seigner . . . pitch their performances perfectly , skilfully underplaying to match carion's understated direction .	subjective
obsessed with her job designing movie sets , fran insists that each prop be the real thing &#173 ; even if it happens to be a pair of rhinoceros eyes or a human finger .	objective
the project's filmmakers forgot to include anything even halfway scary as they poorly rejigger fatal attraction into a high school setting .	subjective
it can't be easy starting a movie in the middle , staying in the middle , and then ending it in the middle . . .	subjective
. . . there's enough cool fun here to warm the hearts of animation enthusiasts of all ages .	subjective
at charlotte's insistence , pally's half-brother ray pays pally a visit and suggests he buy a race horse to cheer up .	objective
sadly , 'garth' hasn't progressed as nicely as 'wayne . '	subjective
character development is conveyed primarily through the combatants actions and the choices they make as they progress across their combat route .	objective
death to smoochy is often very funny , but what's even more remarkable is the integrity of devito's misanthropic vision .	subjective
the transfer to the imax screen diminishes none of the film's drama , which was always much more about human emotions than technology .	subjective
the actors pull out all the stops in nearly every scene , but to diminishing effect . the characters never change .	subjective
a fairly harmless but ultimately lifeless feature-length afterschool special .	subjective
while playing , young t&#252 ; rlich falls unconscious onto a duck nest and is carried away forever by the small river .	objective
believing his parent's dead , bruce is raised by adoptive parents .	objective
after a long inventory of break-up mishaps , nick enlists the help of his best friend to plan the perfect escape from his overbearing girlfriend .	objective
since many people are dead , the tall man is able to make thousands of dwarf slaves for his planet daily in the mormon mausoleum .	objective
director yu seems far more interested in gross-out humor than in showing us well-thought stunts or a car chase that we haven't seen 10 , 000 times .	subjective
i have to admit i walked out of runteldat . i did go back and check out the last 10 minutes , but these were more repulsive than the first 30 or 40 minutes .	subjective
teens are borrowing the family car to drive to manhattan with hopes of being picked to enter studio 54 .	objective
in the year 2009 , a new drug known as blood heat is developed .	objective
through battles and adventures ahas and his companions grow up , but destiny has some bitter surprises to offer .	objective
one boy needs to avenge the death of his father . . .	objective
far from perfect , but its heart is in the right place . . . innocent and well-meaning .	subjective
those who want to be jolted out of their gourd should drop everything and run to ichi .	subjective
the corpse count ultimately overrides what little we learn along the way about vicarious redemption .	subjective
a geo-political thriller where gerry anderson finds that sometimes , everybody really is out to get you .	objective
i certainly found its depiction of a family affected by grief far more believable and effective than the strident dish-breaking , breast-beating of in the bedroom .	subjective
by the time you reach the finale , you're likely wondering why you've been watching all this strutting and posturing .	subjective
yakusho , as always , is wonderful as the long-faced sad sack . . . and his chemistry with shimizu is very believable .	subjective
this may be the last chance that these stories may be documented , for unlike film and television , live theatre exists only in the memories of those who were there watching , or more importantly , creating this magic .	objective
andersson creates a world that's at once surreal and disturbingly familiar ; absurd , yet tremendously sad .	subjective
highlights include detailed instructions on how to perform an icepick lobotomy with household utensils ; a cacophony of robotic voices ; and haunting stills that date back to the turn of the twentieth century .	objective
blade's team and the bloodpack are the only line of defense which can prevent the reaper population from wiping out the vampire and human populations .	objective
their stories of desire , talent , conviction , obsession and addiction are woven together and build up to a climactic series of events that bring them to opening night .	objective
the vitality of the actors keeps the intensity of the film high , even as the strafings blend together .	subjective
i'll go out on a limb . it isn't quite one of the worst movies of the year . it's just merely very bad .	subjective
how would you feel if when you woke , the nightmare had just begun ?	objective
together , they work through their mutual mistrust and their shared grief over the death of carlos' mother rosario .	objective
as patients mysteriously disappear , and the body count mounts , even the exterminators , ratmaster general " hans " ( john paul young ) and his assistant , " jim " ( adam redmond ) are no contest for the awesome force of this hybrid rodent strain .	objective
but fowler soon discovers cho cho is the only dog in the world who can speak to humans . . .	objective
he's dead ; and all their money is gone .	objective
after he's dumped on valentine's day by mallory , his girlfriend of three years , charlie finds himself obsessed and unable to live a normal life without her .	objective
a supernatural mystery that doesn't know whether it wants to be a suspenseful horror movie or a weepy melodrama . it ends up being neither , and fails at both endeavors .	subjective
the misery of these people becomes just another voyeuristic spectacle , to be consumed and forgotten .	subjective
schefberg has the courage to make the story messily un-formulaic .	subjective
the hours makes you examine your own life in much the same way its characters do , and the experience is profound . the hours is what movies are supposed to be . . .	subjective
fisher has bared his soul and confronted his own shortcomings here in a way . . . that feels very human and very true to life .	subjective
deep in the northwest , there is a lone ranch tucked away so purposefully , the only way to find it is by not looking .	objective
the driver finds himself in a dangerous , yet highly political situation ; this time being pursued by a helicopter gunship while carrying a passenger with a suitcase . . .	objective
he lures her back to las vegas to continue her career .	objective
will anyone who isn't a fangoria subscriber be excited that it hasn't gone straight to video ?	subjective
once convicted , he ends up on death row in texas himself , telling his story to a reporter through a series of flashbacks .	objective
friday after next has the same problem that next friday did -- it's called where's chris tucker when you need him ?	subjective
aloof and lacks any real raw emotion , which is fatal for a film that relies on personal relationships .	subjective
as with too many studio pics , plot mechanics get in the way of what should be the lighter-than-air adventure .	subjective
as the empire strikes back was to star wars , so harry potter and the chamber of secrets is to last year's freshman introduction . in short , it's bigger and better .	subjective
guru gulab leaves india for america and comes to stay in the neighbourhood of dr . anmol acharya ( aftab shivdasani ) .	objective
the elders bikes are unfortunately backed over at the post office and they end up bumming a ride with an older but kindly man .	objective
a keep-'em-guessing plot and an affectionate take on its screwed-up characters .	subjective
tina tyler cleverly directs five vignettes with unabashed sexual prowess .	objective
a thoughtful look at a painful incident that made headlines in 1995 .	subjective
traffics in the kind of prechewed racial clichés that have already been through the corporate stand-up-comedy mill .	subjective
mostly , [goldbacher] just lets her complicated characters be unruly , confusing and , through it all , human .	subjective
rosetta projects seduction scenes from movie clips onto ruby , which absorbs as she sleeps .	objective
crazy jones is the story of finnigan jones , a depressed , semi-suicidal leaf-blower with tourette's syndrome ( t . s . ) .	objective
context is provided by those who protested against segregation and the limited franchise earlier in bermuda by authoring a " secret document " that analysed the social problems of the island .	objective
in auteil's less dramatic but equally incisive performance , he's a charismatic charmer likely to seduce and conquer .	subjective
the four girls are teased and discriminated against by their other colleagues and are finally fired by their beautiful , evil boss christine .	objective
arjun is already the number one person on several men&#180 ; s hit lists and must overcome this and everything he encounters on his hunt .	objective
like the chilled breath of oral storytelling frozen onto film .	subjective
solaris " is a shapeless inconsequential move relying on the viewer to do most of the work .	subjective
it's a lovely film with lovely performances by buy and accorsi .	subjective
ratliff speaks the truth about these pentecostal extremists with fairness and compassion , while the well-intentioned churchgoers shout only semi-truths in a frightfully un-christlike fashion .	subjective
the deeper john digs , the clearer the mothman's purpose arises - only to leave his life in immediate danger , as it seems .	objective
in imax in short , it's just as wonderful on the big screen .	subjective
fans can rejoice that mr . deeds is a close third behind happy gilmore and the wedding singer on sandler's list of quality credits .	subjective
forging a connection with the creature is easier for mac than getting his father's attention until both man and beast need all the help they can get .	objective
audrey tatou has a knack for picking roles that magnify her outrageous charm , and in this literate french comedy , she's as morning-glory exuberant as she was in amélie .	subjective
the movie doesn't think much of its characters , its protagonist , or of us .	subjective
and in the dogs , she finds lost pieces of herself as she fumbles with the leash to her own life - struggling to hold on as it pulls her toward a brighter future before her past catches up with her .	objective
then he meets syd , a 12 year-old girl with bright clothes and green hair .	objective
a portrait of a generation that has evolved into individuals and lost respect for the gift of love .	objective
meanwhile , more people end up dead . . .	objective
for all its random chaos , divine secrets works because of the power of its convictions -- and its cast .	subjective
90 punitive minutes of eardrum-dicing gunplay , screeching-metal smashups , and flaccid odd-couple sniping .	subjective
one of the most plain , unimaginative romantic comedies i've ever seen .	subjective
her son has difficulty in understanding why his father was killed and today lies in one of the 124 tombs of jewish prisoners in a cemetery on the banks of the indian ocean .	objective
the casting of von sydow . . . is itself intacto's luckiest stroke .	subjective
julie davis is the kathie lee gifford of film directors , sadly proving once again ego doesn't always go hand in hand with talent .	subjective
the film follows three tracks : banks's slow recruitment of bennie , the set-up for the hit at a swank resort in mexico , and the fbi's close pursuit of banks , whom they want alive in hopes he'll rat out his bosses .	objective
like a veteran head cutter , barbershop is tuned in to its community .	subjective
the last ones , in denial of the inevitable , have waited too long in the security of their own homes .	objective
but when his lab assitant , a monkey named jojo , causes the accidental addition of chemical x to the mix , the professor ends up with not one but 3 perfect , powerful little girls .	objective
this is the story of ryan , a thirty-something office worker , persecuted by his supervisor angela and under-appreciated his fianc&#233 ; e jo .	objective
as a young writer , her fun loving , witty and kind personality represent everything that rio is not .	objective
an exceedingly clever piece of cinema . another great what you don't see' is much more terrifying than what you do see thriller , coupled with some arresting effects , incandescent tones and stupendous performances	subjective
a poetic drama about a young military driven boy named sean who recieves a video tape of a murder , only to discover that it's a government operation that he has interfered with .	objective
they fight with glass plates , staple guns , light bulbs , fire and other homemade weapons .	objective
[smith] simply celebrates the universal desire to fashion our homes for our needs and desires .	subjective
seven-year-old sang-woo is left with his grandmother in a remote village while his mother looks for work .	objective
it's the kind of film where the villain even gives an evil look for his passport photo . how can you resist that ?	subjective
light , silly , photographed with colour and depth , and rather a good time .	subjective
every joke is repeated at least four times . every joke is repeated at least four times . every joke is repeated at least--annoying , isn't it ?	subjective
but grace has a secret and it is a dangerous one .	objective
moving to the big city , deeds finds himself besieged by opportunists all gunning for their piece of the pie .	objective
stefan balsiger is a congenial , average councillor to the swiss embassy in havanna .	objective
what if fate intervened and hitler was forced into hiding in post-war london ?	objective
separated from his wife , louis will be given the opportunity to find out what is most important . . .	objective
most of the information discussed in this portion of the film has never been made public before .	objective
seeing as the film lacks momentum and its position remains mostly undeterminable , the director's experiment is a successful one .	subjective
in a strange way , egoyan has done too much . he's worked too hard on this movie .	subjective
" new suit " is a contemporary update of the fairy tale " the emperor's new clothes . "	objective
this thing works on no level whatsoever for me .	subjective
purpo$e is the story of young internet entrepreneur , john elias .	objective
this is a beautifully sensitive portrait of a unique school and , a very special teacher .	subjective
it seems that vince's sister , sara , has shown up too , about 22 years after she was abducted and murdered .	objective
" on guard ! " won't be placed in the pantheon of the best of the swashbucklers but it is a whole lot of fun and you get to see the one of the world's best actors , daniel auteuil , have a whale of a good time .	subjective
seeing it as a westerner is an enlightening , even liberating , experience .	subjective
both of them create the most important cofee plantation in cuba with a very special philosophy of the slave work and comunity .	objective
she spends the night with pqd , one of the musicians .	objective
no matter what people tried , nothing could stop the water .	objective
frodo and sam take gollum prisoner and continue on to mordor on the mission to destroy the one ring .	objective
a brilliant pianist , a polish jew , witnesses the restrictions nazis place on jews in the polish capital , from restricted access to the building of the warsaw ghetto .	objective
what we have here isn't a disaster , exactly , but a very handsomely produced let-down .	subjective
the dramatic scenes are frequently unintentionally funny , and the action sequences -- clearly the main event -- are surprisingly uninvolving .	subjective
ford is now on the run trying to clear his name from the murder with trey and his gang looking for his blood .	objective
however , as ancanar grew into manhood , he became restless .	objective
sure , there are flaws , but the moments that do things properly see the screen burst with confidence , rhythm , heat and pizzazz .	subjective
a documentary examining the december 2nd , 1999 assassination of microsoft ceo bill gates in los angeles , and the group of key players seeking to unravel the mystery of his alleged assassin as well as the circumstances surrounding his death .	objective
the teamster's union goes on strike against overnite transportation , a nationwide freight company that has resisted unionization .	objective
ritchie's film is easier to swallow than wertmuller's polemical allegory , but it's self-defeatingly decorous .	subjective
the cast is uniformly excellent . . . but the film itself is merely mildly charming .	subjective
not exactly worth a drum roll but a movie with enough collegiate ka-boom to earn its title , drumline is a percussion-driven musical variation on every sports pic you've seen about the talented hot dog who eventually learns to become a team player .	subjective
the first half is a hilariously on-target send-up of " barbarella " -style flicks and the larger-than-life egos that propelled them , the second half is a ponderously self-absorbed meditation on the angst of a budding artiste .	subjective
mazel tov to a film about a family's joyous life acting on the yiddish stage .	subjective
it's a much more emotional journey than what shyamalan has given us in his past two movies , and gibson , stepping in for bruce willis , is the perfect actor to take us on the trip .	subjective
remember when bond had more glamour than clamor ? no more .	subjective
if the film fails to fulfill its own ambitious goals , it nonetheless sustains interest during the long build-up of expository material .	subjective
adapted from a monologue in his " blue jam " radio series , chris morris' first short film is a haunting black comedy about a man who no longer uses his name because he's decided he's ceased to deserve one , and a dog called rothko who says he is the man's lawyer .	objective
after having christmas present and rent money stolen by someone posing as santa , they get jobs working as unarmed security guards in the local mall , they get threatened with eviction , pick up girls , get drunk , take drugs and need quick cash .	objective
but with tess's wedding coming on saturday , the two have to find a way to switch back - and fast .	objective
seemingly a vehicle to showcase the canadian's inane ramblings , stealing harvard is a smorgasbord of soliloquies about nothing delivered by the former mr . drew barrymore .	subjective
when he dumps her , the whole building turns on him .	objective
the egoists is an ensemble piece that reveals the lives of several characters as they are brought together to mount a theatrical production .	objective
i haven't seen such self-amused trash since freddy got fingered .	subjective
this epic film , eschewing dialogue and conventional narrative logic , tells a gripping tale of biological drama through a highly improbable series of evocative images , superb acting and editing , and haunting music .	subjective
it seems like a perfect opportunity for kilo to get back to his family , but this job leads to a world of trouble for kilo after his release .	objective
steve and eric are average guys living average lives with their average wives in the small suburban town of freehold , new jersey .	objective
[t]his slop doesn't even have potential as a cult film , as it's too loud to shout insults at the screen .	subjective
these camps were surrounded by barb wire and guard towers .	objective
while broomfield's film doesn't capture the effect of these tragic deaths on hip-hop culture , it succeeds as a powerful look at a failure of our justice system .	subjective
it goes on for too long and bogs down in a surfeit of characters and unnecessary subplots .	subjective
rather than spreading good cheer , the duo's motive is to rob each establishment , a strategy that becomes complicated when they encounter a precocious 8-year old that teaches them the true meaning of christmas .	objective
writer-director steven soderbergh follows up ocean's 11 with the low-budget 'full frontal' , his first digitally shot film .	objective
this will cause tremendous natural disasters , wiping out life as we know it .	objective
upon discovering her infidelity , roxie's husband amos refuses to take the blame for the murder and roxie is sent to jail , pending hanging .	objective
the story starts with hakimi , a freelance scriptwriter who is on his way to send his 7-year-old daughter , imelda , to his ex-wife's house on one stormy night .	objective
it's the kind of movie you can't quite recommend because it is all windup and not much of a pitch , yet you can't bring yourself to dislike it .	subjective
while the new film is much more eye-catching than its blood-drenched stephen norrington-directed predecessor , the new script by the returning david s . goyer is much sillier .	subjective
a generic bloodbath that often becomes laughably unbearable when it isn't merely offensive .	subjective
set in 1989 , during the historical week in which the berlin wall came tumbling down .	objective
the draw [for " big bad love " ] is a solid performance by arliss howard .	subjective
although disney follows its standard formula in this animated adventure , it feels more forced than usual .	subjective
j-lo strikes back in a tense and thrilling revenge flick with the best fight scene so far this year . but i couldn't help feeling guilty over my delight at the brutal way 'enough' ended .	subjective
the mystery guests soon unleash a stiff sentence of their own , without parole , teaching the judge the consequence of doing unto others as you would have done unto you .	objective
a film that clearly means to preach exclusively to the converted .	subjective
it tries too hard , and overreaches the logic of its own world .	subjective
clerick john preston ( bale ) is a top ranking government agent responsible for destroying those who resist the rules .	objective
leave it to rohmer , now 82 , to find a way to bend current technique to the service of a vision of the past that is faithful to both architectural glories and commanding open spaces of the city as it was more than two centuries ago .	subjective
he led a bleak life , stuck in a boring routinity created by his ambition to become a sucessfull producer in one jakarta's leading tv station .	objective
their race against the clock to find the precious stones ultimately unravels a plot to distribute a deadly new weapon of war .	objective
the brass are convinced this is a serial killer chosing victims at random , but sam and buckley discover a pattern involving health personnel who work in neonatal intensive care .	objective
the ill-conceived modern-day ending falls flat where it should deliver a moral punch .	subjective
a young boy is devastated when the planned vacation with his father is cancelled due to an emergency salvage mission at a remote canadian lake .	objective
it's difficult to conceive of anyone who has reached puberty actually finding the characters in slackers or their antics amusing , let alone funny .	subjective
it aimlessly and unsuccessfully attempts to fuse at least three dull plots into one good one .	subjective
sparkling , often hilarious romantic jealousy comedy . . . attal looks so much like a young robert deniro that it seems the film should instead be called 'my husband is travis bickle' .	subjective
the film is a confusing melange of tones and styles , one moment a romantic trifle and the next a turgid drama .	subjective
what drives a young african-american man to become a member of the republican party and to run for a united states congressional seat in a district in south georgia with a disturbing racist history ?	objective
